<?xml version="1.0" encoding="UTF-8"?>
<!ELEMENT routingTable				((item)*)>
<!ATTLIST routingTable
	DTDversion		CDATA #REQUIRED
>
<!-- DTD version: 1.1 -->

<!ELEMENT item						((source), (destination)+, (options)*)>

<!ELEMENT source (sourceBusID, sourceObjectID, sourceType)>
<!ELEMENT sourceBusID				(#PCDATA)>
<!ELEMENT sourceObjectID			(#PCDATA)>
<!ELEMENT sourceType				(#PCDATA)>

<!ELEMENT destination (destinationBusID, destinationObjectID, destinationType, backboneCTID, backboneTransferType)>
<!ELEMENT destinationBusID			(#PCDATA)>
<!ELEMENT destinationObjectID		(#PCDATA)>
<!ELEMENT destinationType			(#PCDATA)>
<!ELEMENT backboneCTID				(#PCDATA)>
<!ELEMENT backboneTransferType		(#PCDATA)>

<!ELEMENT options ((holdUpTime)*)>
<!ELEMENT holdUpTime				(#PCDATA)>